day,time,type,title,abstract,author,affiliation,slides,youtube
1,9:15 AM,opening-remarks,Opening Remarks,,Richard McCullough,Harvard University,,
1,9:25 AM,keynote,Modernizing the new drug regulatory program in FDA/CDER: Can Collaborations and Sharing Help?,"Lilliam will be presenting a perspective on what the office of computational science is doing to support regulatory review for safety assessments. She will explore the concept of collaborations and sharing to support process and transparency, along with a perspective with the use of R.",Lilliam Rosario,FDA,,
1,10:10 AM,talk,Using R in a regulatory environment: some FDA perspectives,"The United States Food and Drug Administration (FDA) uses a variety of statistical software packages for review and research. This presentation will focus on the uses of R in the Center for Drug Evaluation and Research (CDER), including graphics for labels, Bayesian designs and analyses, simulations, machine learning, data quality and data integrity efforts, as well as interactive visualizations using R Shiny. Some of the challenges with using R will be discussed, as well as advantages of using R to collaborate with colleagues in industry and academe through Cooperative Research and Development Agreements (CRADAs), Broad Agency Agreements (BAAs), and working groups associated with professional societies (ASA, DIA, PhUSE).",Paul Schuette,FDA,https://github.com/rinpharma/2018_presentations/blob/master/talks_folder/2018-Schuette-R_in_a_Regulatory_Environment.pptx,
1,10:30 AM,talk,Using R in a GxP Environment,"The Data Science team in Pfizer’s Vaccine Research and Development division (VRD) creates and maintains validated applications used during high-throughput clinical testing that enable advanced analytic and reporting requirements. SAS has long been the de-facto standard for analyzing data in a regulated GxP environment. Web deployment of these applications has been the best approach, and Pfizer VRD has developed several mid-tier applications in Java that submit batch SAS processes on a High Performance Computing grid. Pfizer VRD’s high level approach is the same across different assay platforms: data are pulled from a combination of electronic files and Oracle databases and analyzed, results are written back to an Oracle database, and electronic output files are made in various formats (e.g. PDF). The regulated nature of Pfizer VRD’s work and the difficulty in deploying R-based applications over the web have previously been an impediment to the use of R, but new tools such as RStudio’s Shiny Server Pro have helped us overcome those challenges. This presentation focuses on a comparison of the architecture used to deploy our SAS applications and the infrastructure required to deploy R-based applications to meet GxP requirements. Real life examples will be provided to illustrate the usefulness of this platform in a regulated laboratory environment.",Boyd Gonnerman // John Sims // Frank DePierro  // Peter Giardina,Pfizer // Pfizer // Pfizer // Pfizer,https://github.com/rinpharma/2018_presentations/blob/master/talks_folder/2018-Gonnerman-R_in_a_GxP_Environment.pptx,
1,10:40 AM,talk,IDBac: A New Paradigm in Developing Microbial Libraries for Drug Discovery,"The success of a bacterial drug discovery program can be no greater than the phylogenetic diversity and capacity of those bacteria in the library to produce specialized metabolites (SM). However, the methods used to create bacterial strain libraries have seen little innovation in nearly 80 years. Current practice relies entirely on colony morphology and/or 16S rRNA gene sequencing analysis to decide which isolated strains to retain for addition to a drug discovery library. However, these practices create inefficient libraries plagued with a high degree of taxonomic and chemical redundancy by relying on physical characteristics that have limited correlation with strains’ SM, the foundation of drug discovery. Therefore, the development of a platform to rapidly prioritize unknown bacterial strains based on phylogeny and SM would greatly increase the efficiency of the front-end of microbial drug discovery. Our lab has recently developed such a platform, called IDBac, which uses in situ matrix-assisted laser desorption/ionization time-of-flight mass spectrometry (MALDI-TOF MS) to analyze protein and specialized metabolite spectra of single bacterial colonies. Utilizing R and Shiny, alongside state-of-the-art packages and techniques in MALDI processing and data visualization, we created a stand-alone executable program for MALDI-TOF MS bacterial analysis. Using unsupervised learning methods and visualizations we have demonstrated IDBac’s capabilities by creating protein and specialized metabolite MS profiles, generating protein MS hierarchical groupings that accurately mirrored phylogenetic groupings and further distinguishing isolates based on inter- and intra-species differences in specialized metabolite production. With the ease of use of modern MALDI instrumentation and interactive, intuitive data exploration, IDBac can rapidly profile up to 384 bacteria in 4 hours. To our knowledge, IDBac is the first attempt to couple in situ MS analyses of protein content and specialized metabolite production and will enable laboratories with access to a MALDI-TOF MS the ability to rapidly create more efficient libraries for their drug discovery programs.",Chase Clark,University of Illinois at Chicago,https://github.com/rinpharma/2018_presentations/blob/master/talks_folder/2018-Clark-IDBac.pdf,
1,10:50 AM,coffee,Break,,,,,
1,11:10 AM,talk,The largest Shiny application in the world. Roche.Diagnostics.bioWARP,"bioWARP (biostatistical Web-Applications and R Procedures) is a Shiny application enabling employees at Roche Diagnostics to create validated reports for regulatory authorities submissions.
 bioWARP enables people using advanced statistical methods, who cannot program R. It builds a connection to the validated R-packages developed at Roche with an easy to use and elegant user interface. Its modular environment can host an unlimited number of such interfaces. bioWARP now consists of tools for reporting reference ranges, equality by linear regression, precision by variance component analysis and homogeneity by inhouse developed equivalence tests .
 bioWARP's most important feature is the ability to move all statistical evaluations right into PDF reports. These are validated and can directly be used for submission to regulatory authorities.
 bioWARP is called the “largest shiny application in the world” by us as it already consists of 16 tools, has over 100.000 lines of code, >500 buttons and interaction items and is growing and growing and growing.",Sebastian Wolf,Roche,,
1,11:30 AM,talk,R reproducibility by containers and cloud,"R is pretty good in backwards compatibility but still reproducing analysis even given script and data can be a challenge as packages, R, and math libraries keep evolving. www.rocker-project.org offers among other things version-stable R in docker (Rocker) images. A small example will be presented how this allows on any docker runtime environment to execute analysis with highest reproducibility. Such environments are part of all major commercial cloud providers but also allow on-premises installations.",Reinhold Koch,Roche / Genentech,https://github.com/rinpharma/2018_presentations/blob/master/talks_folder/2018-Koch_Reproducibility_by_Containers_and_Cloud.pdf,
1,11:40 AM,talk,Multi-state Model for the Analysis of an Association between Safety and Efficacy Events,"Safety and efficacy data in clinical trials are mostly analyzed separately. However, especially the treatment of life-threatening disease such as cancer requires a good understanding of benefit and associated risks to make an informed therapy decision for an individual patient. Recently approved immunotherapeutic drugs in oncology are associated with potential side effects such as immune-related hypothyroidism, rash and colitis. There is some biological reasoning that the occurrence of immune-related adverse events and corresponding management may compromise the drug response. On the other hand, it has been observed that patients responding to treatment might face a higher likelihood of adverse drug reactions. A multi-state model is able to explore these hypotheses and offers the opportunity of insights into potential associations while addressing some of the methodological challenges. For example, the necessity of a time-dependent approach to accommodate the fact that safety and efficacy events can occur throughout the treatment. Moreover, longer treatment duration can impact simultaneously the likelihood of efficacy as well as safety events, i.e., introducing immortal time bias. The multistate model is able to unfold this spurious correlation. We present an approach for analysis and exemplify the methodology with simulated data.",Juliane Manitz,EDM Serono,https://github.com/rinpharma/2018_presentations/blob/master/talks_folder/2018-Manitz-Association_between_Safety_and_Efficacy_Events.pdf,
1,12:10 PM,lunch,Lunch,,,,,
1,1:30 PM,talk,Becoming bilingual in SAS and R,"In this talk, I will speak about my personal journey of learning R and transforming from a clinical study statistical programmer to a SAS/R bilingual, as well as my journey of leading the R initiative in Amgen’s Global Statistical Programming Department and Amgen R meetup, working with IS, statistician, quality, LMS and external partners. I will conclude by talking about the areas of challenge and the direction of R for statistical programming in a regulated environment and proposals for R in Pharma collaboration.",Bella Feng,Amgen,,
1,1:40 PM,talk,Visualization methods for RNA-sequencing data analysis,"RNA-seq data is biased and accurate detection of differentially expressed genes (DEGs) is not a trivial task. While the data collection can be considered high-throughput, data analysis has intricacies that require careful human attention. The most effective approach to modern data analysis is to iterate between models and visuals, and to enhance the appropriateness of models based on feedback from visuals. As it stands, there is a need to make it easier for scientists and clinicians to use models and visuals in a complimentary fashion during RNA-seq data analysis. Here, we use public RNA-seq data to show that our visualization tools can detect normalization problems, DEG designation problems, and common errors in RNA-seq analysis. We also show that our tools can identify genes of interest that cannot be obtained with models. Through this project, we propose that users slightly modify their approach to data analysis by quickly assessing the sensibility of their models with statistical graphics. We plan to publish a new R software package that includes the plotting techniques introduced in this project, which can be useful for exploring several types of multivariate biological data such as RNA-sequencing data.",Lindsay Rutter,Iowa State University,,
1,1:50 PM,talk,The Use of R in the Development of Physiological Model for Healthy Growth,"A physiologically-based mathematical model was developed as a series of ordinary differential equations to describe compositional changes (in fat and fat-free mass, FM & FFM) due to metabolizable energy exchanges in babies from birth to 2 years in low-to-middle income countries.1 The objective of this work was to identify potential biomarkers for future intervention studies, identify when to intervene to protect and/or rescue growth in individuals suffering from malnutrition, and to identify which of these individuals would be more or less likely to respond to a nutritional intervention.
 A translation of this model (155 parameters and 26 compartments) using R and the open-source mrgsolve package2 provided an efficient platform for multi-parameter optimization, as required during additional model development and for subsequent simulations. For comparison, a 8.62 seconds simulation with viral and bacterial infections (no interventions) in the R/mrgsolve implementation required 226 seconds in Matlab. Model translation to R also enabled simulations with a Shiny App, allowing users to simulate individual infant phenotypes and infection events and visualize growth and energy levels over time, relative to healthy (WHO) standards.
 The model currently also includes a relatively simple implementation of persistent antibiotic therapy with a potential for inclusion of drug exposure-related effects, i.e. - through a pharmacokinetic (PK) model, to describe effects of antiviral or antibiotic therapy. The challenge to this development is the scarcity of available data describing this therapy in malnourished children that would be needed for model calibration. Further development of the model includes linking to other systems models such Mother-fetus energy exchange or PBPK mother-fetus models, to enable simulations of growth beginning at gestation.",Rena J. Eudy-Byrne,Metrum Research Group,https://github.com/rinpharma/2018_presentations/blob/master/talks_folder/2018-Byrne-Physiological_Model_for_Healthy_Growth.html,
1,2:00 PM,talk,Antibody Characterization Using Next Generation Sequencing made easier with Group My Abs shiny app,"Next-generation sequencing (NGS), phage display technology and high throughput capacities enables biologists in drug discovery to characterize antibodies (Abs) based on their HCDR3 sequences and further group them into families before moving to hit-to-lead stage of drug discovery and development. This enables diversification of Ab portfolio and insures back up options if Ab candidate fails. However, there was no method or software available in-house to support Ab discovery with capacities to apply biophysical rules to classify the sequences. 
 Shiny app ""Group My Abs"" was developed to apply biophysical properties for Ab characterization to the NGS data. Several Multiple Sequence Alignment algorithms implemented in the app enable sequence comparability. A method was developed to evaluate differences between comparable sequences and subsequently classify sequences into families. The app provides custom-made and interactive data visualization, enables refined Ab classification in a mathematical manner, considerably increases efficiency and insures reproducibility. This all decreases bias and enables informative decision making during the hit-to-lead stage in biologics drug discovery.",Volha Tryputsen,Janssen,https://github.com/rinpharma/2018_presentations/blob/master/talks_folder/2018-Tryputsen-Antibody_Characterization_NGS_Group_My_Abs.pdf,
1,2:10 PM,talk,Managing R and Associated Tools in Large Environments - an R-Admin’s Perspective,"The dramatic increase of R in the computational, analytics, and data science areas has led to some innovative techniques in recent years for interactive analytics. This rate of change presents challenges for IT organizations to keep up and to maintain their software stacks for scientists for regulated and non-regulated environments.
 Techniques and Best Practices for managing updates and use cases will be presented from an R-Admin's perspective using a combination of opensource and professional tools.",Ed Lauzier,Merck,,
1,2:20 PM,coffee,Break,,,,,
1,2:50 PM,keynote,Modeling in the tidyverse,"The tidyverse (tidyverse.org) is an opinionated collection of R packages designed for data science. All packages share an underlying design philosophy, grammar, and data structures. The packages primarily consist of tools for data ingest, manipulation, and visualization. In the last year or so, Rstudio and others have been creating a set of packages focused on the modeling process. In this talk, we will introduce the tidyverse and illustrate these new tools whose goals are to: simplify the modeling process, encourage empirical validation and good methodology, and to enable a wider variety of approaches.",Max Kuhn,Rstudio,http://appliedpredictivemodeling.com/blog/rpharma18,
1,3:35 PM,talk,ShinyRAP - a framework for analysis and building interactive/dynamic reports using Shiny/Markdown,"R has become a prominent data science tool, empowered by a fast-growing modern R eco-system. At Novartis, Shiny and markdown have gained a lot of popularity in analyzing, visualizing and reporting of clinical trial data. Traditional report analysis plan (RAP) process was designed to create static table, figure and listings. In this talk, I will use ShinyRAP (a shiny app) to illustrate a novel framework/workflow of planning and executing of both pre-specified and ad-hoc analyses, as well as building dynamic/interactive reports through R/Shiny/Markdown. The app features efficient and organized programming through meta-data and shiny modules, and dynamic display of results via multi-select, grouping and searching, etc. Although motivated from a clinical trial data context, this framework can also be used for other types of data.",Xiao Ni,Novartis,,
1,3:55 PM,talk,Data-Driven Strategies for Synthetic Route Design and Operational Modeling within Pharmaceutical Development,"Decision analysis balancing both data analytics and human gut feeling is critical in designing efficient routes to synthesize new, complex small molecules. This challenge is faced by any organization seeking to deliver modern pharmaceutical compounds to patients in a prompt manner. In this presentation, we highlight the incorporation of data science approaches using R to develop metrics that aid in the development process: current complexity, risk quantification, and process efficiency forecasting. Current complexity is a metric established from human insights that assesses a molecule’s complexity in the context of capability, tracking the ‘current’ complexity of a given molecule over time and enabling the quantitative assessment of a new route or process. Risk quantification utilizes a Bayesian framework to quantify risk from real data and operational patterns, at both the project and portfolio level, for assessing the delivery risk of early candidate nomination assets in areas such as FTE resource modeling. Process efficiency can be estimated with a predictive analytics framework capable of quantifying the probable efficiency of a proposed synthesis or benchmarking the outcome performance of the developed process, thereby minimizing the environmental impact of pharmaceutical production. These strategies have been effectively used to aid the decision-making processes for pharmaceutical R&D.",Jun Li,BMS,,
1,4:05 PM,talk,Evaluating the performance of advanced causal inference methods applied to healthcare claims data,"Cohort studies of treatments developed from healthcare claims often have hundreds of thousands of patients and up to several thousand measured covariates. Therefore, new causal inference methods that combine ideas from machine learning and causal inference may improve analysis of these studies by taking advantage of the wealth of information measured in claims. In order to evaluate the performance of these methods as applied to claims-based studies, we use a combination of real data examples and plasmode simulation, implemented in R package ‘plasmode’, which creates realistic simulated datasets based on a real cohort study. In this talk, I will give an overview of our progress so far and what is left to be done.",Jessica Myers Franklin,Harvard University,,
1,4:15 PM,talk,"Optimization of raw materials genealogy in drug manufacturing with R, Shiny and d3","Failure to thoroughly review discrepancies and deviations in drug manufacturing is consistently one of the top citations in FDA inspectional observations. Learn how a leading biotechnology organization successfully replaced an inefficient, manual inspection process with a genealogy visualization and inspection solution to optimize drug manufacturing quality control. This session will cover implementation approaches and lessons learned in data mapping, technology selection, visualization development, and predictive model generation.",Tanya Cashorali,TCB Analytics,https://github.com/rinpharma/2018_presentations/blob/master/talks_folder/2018-Cashorali-Optimization_of_raw_materials_genealogy_in_drug_manufacturing.pdf,
1,4:25 PM,talk,REAP - R-Shiny Exploratory Analysis Platform in Clinical Pharmacology,"REAP (R-Shiny Exploratory Analysis Platform) was developed by the Modeling and Simulation group within the Clinical Pharmacology department at Genentech, Inc., to support exploratory analyses of clinical data. REAP is a web-based, user-friendly, tool providing standard methods and outputs for conducting typical analyses within a clinical pharmacology group. With REAP, a clinical pharmacologist or pharmacometrician can perform Exposure-Response, dose linearity, and concentration-corrected QT analyses, PKPD simulations, NONMEM data quality checks, and PK graphic analyses without writing code. Results can be used to enhance scientific understanding of the relationship between exposure, response, and the PK characteristics of the molecule. In this talk, I will demonstrate how REAP can be used to perform dose linearity and Exposure-Response analyses.",Qi Liu,Genentech,https://github.com/rinpharma/2018_presentations/blob/master/talks_folder/2018-Li-Synthetic_Route_Design_and_Operational_Modeling.pptx,
1,4:35 PM,talk,rOpenSci - enabling open and reproducible research,"The rOpenSci project is a non-profit initiative founded as a grassroots effort in 2011. We have evolved into a truly global community of researchers and data scientists who are R users and developers from a wide range of disciplines. rOpenSci advocates for a culture of open and reproducible research. We do this by creating technical infrastructure in the form of carefully vetted, staff- and community-contributed R software tools that lower barriers to working with scientific data sources on the web. We have developed a highly successful model for peer review of scientific software that provides transparent, constructive and collegial review of R packages. 
 Our community is our best asset. We are building social infrastructure in the form of a welcoming and diverse community. rOpenSci.org hosts blog posts by authors and reviewers of onboarded packages to share both functionality and lessons learned; we promote these on social media to bring their work to a wider audience. Our discussion forum, community calls and annual hackathon-flavored unconference are designed to share best practices and to build a trust network for the often challenging discussions about doing research more reproducibly.",Stefanie Butland,rOpenSci,https://github.com/rinpharma/2018_presentations/blob/master/talks_folder/2018-Butland-rOpenSci_Enabling_Open_and_Reproducible_Research.pdf,
1,5:05 PM,talk,"Beyond Simple Reproducibility - Discoverability, Provenance, and Improving the Impact of Results","Research is an incremental, iterative process, with new results relying and building upon previous ones. Scientists need to find, retrieve, understand, and trust results in order to confidently extend them, even when the results are their own. We present the GREX framework, which facilitates this iterative process via the principled management of computational results. GREX combines robust storage, provenance tracking, automated annotation, discoverability, and reproduciblity of computational results. We will discuss both the underlying conceptual work and our reference implementation of our framework.",Gabe Becker,Genetech,,
2,9:15 AM,opening-remarks,Opening Remarks,,Dustin Tingley,Harvard University,,
2,9:25 AM,keynote,Using interactivity responsibly in pharma,"Shiny is a package for turning analyses written in R into interactive web applications. This capability has obvious applications in pharma, as it lets R users build interactive apps for their collaborators to explore models or results, or to automate workflows. However, the interactivity of Shiny apps is a double-edged sword, as it introduces challenges to the traceability and reproducibility of your analysis. To use interactive applications in pharma responsibly, these challenges must be addressed. In this talk, I'll look at some of the tools and techniques you can use in Shiny to deal with these challenges head-on.",Joe Cheng,Rstudio,https://speakerdeck.com/jcheng5/using-shiny-responsibly-in-pharma,
2,10:10 AM,talk,"Interactive data visualization with R, plotly, and dashR","Interactive web graphics are a popular and convenient medium for conveying information. However, web graphics are rarely used during the initial exploratory phase of a data analysis, largely due to the lack tools for seamless iteration between data manipulation, modeling, and visualization. As we've known for several decades, interactive graphics can augment exploratory analysis, but are only practical when we can iterate quickly. This talk demonstrates how to use the R packages plotly and dashR to rapidly produce interactive web graphics and applications that augment data exploration in addition to being easily distributed.",Carson Sievert,Sievert Consulting LLC,,
