day,time,type,title,abstract,author,affiliation,slides,youtube
2,10:30 AM,talk,Developing powerful Shiny applications in an enterprise environment: Best practices and lessons learned,"Recent advances in the Shiny ecosystem boost the scale and scope of serious enterprise-wide web applications. More specifically, it is entirely possible to utilize key features of Shiny Server Professional and additional R packages such as shinyjs, DT, and batchtools to build Shiny applications that supports session management, high-performance computing, and reproducibility in a friendly and logical interface. Additionally, the shinytest package enables a robust workflow for developing applications efficiently, as well as being an important component to automate a validation testing framework. In this talk, I will share examples of key features and lessons learned in creating a technically powerful shiny application that integrates these pieces together.",Eric Nantz,Eli Lilly,https://rpodcast.gitlab.io/rpharma2018/,
2,10:50 AM,coffee,Break,,,,,
2,11:10 AM,talk,NetTCR: Towards Accurate Prediction of T-cell Targets using Deep Learning,"The interaction between the Major Histocompatibility Complex type I (MHC-I), a peptide and the T-cell receptor (TCR) (MHCI::p::TCR) is a key determinant of immune response elicitation and
 therefore of paramount importance in infectious- and autoimmune diseases and cancer. Current state-of-the-art models developed by our group can with great precision model MHCI::p
 interactions. Using data from VDJdb and IEDB, we created an ensemble of convolutional neural networks, which to the best of our knowledge is the world’s first sequence based model capable
 of capturing the entire MHCI::p::TCR system. Due to limited data, we however currently can only model the interaction between the CDR3 region of the TCR’s beta chain with HLA-A*02:01 and 3
 peptides. However, as the model framework is easily extendable, we will increase the breadth and thus improve the model, as soon as more data become available. Using the current model and an
 independent test set, we obtained AUC = 0.747.
 TensorFlow is an open source software library for neural network models made by Google. Recently RStudio released Keras an API for accessing TensorFlow in R. Keras enables fast
 experimentation - Being able to go from idea to result with the least possible delay is key to doing good research.",Leon Eyrich Jessen,Technical University of Denmark,,
2,11:30 AM,talk,Analyzing Clinical Trials Data with R,"Creating datasets and tables, listings and graphs (TLGs) for analyzing clinical trials data with R, such that in the final stage the code, datasets and TLGs can be submitted to the health authorities, is a multifaceted problem. We have been working on a number of R packages to create an R-based analysis environment that can be used for exploratory and regulatory analysis of clinical trials data. These projects include: table creation (open source http://github.com/Roche/rtables); random data generation; querying CDISC standards; TLG creation; a pipeline for specifying and producing data and TLG deliverables (with logs, automation, titles and footnotes, etc.); a modular shiny-based exploratory framework that provides dynamic encodings, variable-based filtering, and R-code generation for the displayed outputs. The maturity of these projects varies, but the workflow and analysis environment as a whole can be demonstrated nicely. In this talk, we would like to generate interest in collaboration in order to make these projects more general and with the final goal of open-sourcing some of them.",Adrian Waddell,Roche,,
2,11:50 AM,talk,Moving Fast Without Breaking Things: Navigating the R Ecosystem in an Enterprise Environment,"Despite the explosive growth and adoption of R globally, concerns over how to qualify and administrate R continues to echo in discussions about use in regulated environments. In this talk, I'll discuss the how to bridge the conceptual tenants of reproducibility, traceability, and accuracy to robust, yet agile, implementations such that and organization can maintain validated systems without imposing the shackles found in traditional validated environments. Furthermore, I will discuss a number of design elements specific to the open-source R ecosystem, such as using packages from CRAN and github, and cover how to embrace these, while responsibly managing risk in enterprise environments.",Devin Pastoor,Metrum Research Group,https://github.com/rinpharma/2018_presentations/blob/master/talks_folder/2018-Pastoor-Moving_Fast_without_Breaking_Things.pdf,
2,12:10 PM,lunch,Lunch,,,,,
2,1:30 PM,talk,Unification in a Compartmentalized Culture,"When it comes to analytics of data collected in medical research, today’s culture is compartmentalized – not only across institutions, but even within institutions. Such a culture stagnates analytical development and limits the ability to fully master the data thereby reducing the effectiveness in communicating clinical information to stakeholders. A unified culture can exist – statisticians, programmers, and clinicians need to speak to each other; regulatory agencies, pharmaceutical companies, and academics need to speak to each other. Once everyone comes together to discuss how the medical research data should be collected, interrogated and presented; analytics can be developed and shared within and across institutions. From an analytics perspective, nothing new needs to be developed, solutions are already available – many of them free. We just need to come together and start talking. So let’s talk.",Mat Soukup,FDA,https://github.com/rinpharma/2018_presentations/blob/master/talks_folder/2018-Soukup-Unification_in_Compartmentalized_Culture.pptx,
2,1:40 PM,talk,R4SPA: R Packages and Training to enable Statistical Programming in R,"R is a very powerful tool for performing statistical programming, but has had a lower uptake in the life sciences when compared to SAS. As a result, many of the packages created for R are not focused on the type of tasks Statistical Programmers do. In this talk I introduce several packages and in house training we are developing to aid regulatory outputs. The R packages include rcompare, a package to allow comparison of datasets, analogous to proc compare in SAS, and r4spa which allows outputs to be in the correct format for production. Each package solves a problem particular to the life sciences, and is intended to improve uptake of R usage within the industry. Similarly, to the R packages, the training is focused on providing examples of actual work, so that users of the training will be able to immediately apply their knowledge.",Kieran Martin,Roche,https://kieranjmartin.github.io/R4SPA-talk/r4spa.html,
2,1:50 PM,talk,Assisting pharmacometric simulation with the use of Shiny,"During the drug development, pharmacometric models are often built to characterize and understand drug efficacy and safety. Simulations based on these models can assist drug development and quantitative decision making. However, computation can be time-consuming and communication with the project team may not be productive.
 Shiny applications are developed as a simulation tool which allows rapid real-time simulations based on user-selected inputs and dynamic visualization of the results. It provides an easy access to individuals with no specific background of modeling and simulation. In the talk, I will present some case studies where the shiny application was used to perform simulations and facilitate the communication with decision makers.",Jia Kang,Metrum Research Group,https://github.com/rinpharma/2018_presentations/blob/master/talks_folder/2018-Kang-Assisting_Pharmacometric_Simulation_with_the_Use_of_Shiny.pdf,
2,2:00 PM,talk,R/Shiny Clinical Dashboards For Fun* and Profit *Note: Fun is Relative,"For the Pharma Company How many times have you made a graph and gotten an email back saying: ""Can we change the axes?"" or ""Can we change the symbols?"" or ""I really need to look at the graph before I can tell you what I want"". It would be much more efficient for your customers to explore the data and the visualizations in an easy-to-use method and can free you up to work on the myriad other tasks you have to do. Rather than learn another programming language, the shiny package uses the R code you already know to create interactive visualizations with a small bit of additional learning. This talk will go over example dashboards for such data as adverse events, labs, and primary endpoints that will aid data managers, statisticians, clinical people, and... even you.",Nate Mockler,Biogen,,
2,2:10 PM,talk,The drake R package: reproducible data analysis at scale,"The drake package is a general-purpose workflow manager for data-driven tasks in R, with applications in the pharmaceutical industry ranging from tailored medicine to clinical trial simulation and beyond. Drake rebuilds intermediate data objects when their dependencies change, and it skips work when the results are already up to date. Not every runthrough starts from scratch, and completed workflows have tangible evidence of reproducibility. Drake is more scalable than knitr, more thorough than memoization, and more R-focused than other pipeline toolkits such as GNU Make, remake, and snakemake.",Will Landau,Eli Lilly,,
2,2:20 PM,coffee,Break,,,,,
2,2:50 PM,keynote,Enabling open-source analytics in the enterprise,"The open-source analytics community is driving innovation in precompetitive spaces like statistical methodology, reproducibility approaches, visualization techniques, and scaling strategies. The diverse and rapdily evolving ecosystem of open-source tools and standards stands in contrast with the disposition of the enterprise towards stability, standardization, and reliability. This talk will present the policies and frameworks we have developed at Genentech to enable internal scientists to responsibly leverage open-source tools and to participate in the community process through their own contributions.",Michael Lawrence,Roche / Genentech,https://github.com/rinpharma/2018_presentations/blob/master/talks_folder/2018-Lawrence-Enabling_open_source_analytics_in_the_enterprise.pdf,
2,3:35 PM,talk,The role of R in converting clinical trial programmers to data scientists,"In 3 years Real World Data Science Analytics in Roche/Genentech transitioned from a small team of former clinical trial programmers supporting a real world evidence team to become the largest department within the Personalised Healthcare (PHC) Centre of Excellence. This transition was driven by industry-wide acknowledgement of the growing importance of leveraging analytics to support PHC, but this change necessitated radical changes in workflows and competencies. To adapt to this change, the team has moved from using a single proprietary software (SAS) to becoming an open source-focused, R based but increasingly programming language agnostic, department. A core driver of this transition was the development of an internal suite of R packages that handled markdown templates and database access through to wrappers for common plots and documenting git hashes of all code used. Bringing this diverse set of tools into a coherent eco-system is a meta-package modelled on the tidyverse.",James Black,Roche,,
2,3:45 PM,talk,Accelerate Personalized Health Care by Empowering Biomarker Data,"In Pharmaceutical industry, personalized patient care is about having access to traditional and new data sources including comprehensive diagnostic data, sensor data, real-world data, etc., applying traditional and advanced analytics like machine learning to create meaningful insights, and then realizing value from those insights for smarter and more efficient research and development (R&D) and improving patient access and personalized patient care. Biomarker research is a key component of the PHC Strategy, complementing efforts to access high-dimensional genomics data and conducting appropriated analysis using right tools differentiate from those for current well-established clinical trials. This paper, in perspective of R&D, describes the close collaboration between China Oncology Biomarker Data group (OBD China) and Product Development Biometrics (PDB) expertise, from sample collection, lab process in biomarker stand-alone studies to meaningful results mainly conducted in R, which enables to prioritize molecule development, inform the design of specific trials and identify R&D opportunities for regional diseases.",Xiuting Mi,Roche,https://github.com/rinpharma/2018_presentations/blob/master/talks_folder/2018-Mi-Accelerate_PHC_by_Empowering_Biomarker_Data.pptx,
2,3:55 PM,talk,Keeping things Peachy when Shiny gets Hairy,Shiny is a popular R package that lets users develop interactive web applications using just R code. The ease of use and downstream boost in productivity mean that working with Shiny can kick off a rapid request-implementation-inspiration-request cycle. Designing your applications with an eye toward future expansion can save time and reduce human error in the long term.,Marianna Foos,Biogen,https://github.com/rinpharma/2018_presentations/blob/master/talks_folder/2018-Foos-Keeping_Things_Peachy_When_Shiny_Gets_Hairy.pptx,
2,4:05 PM,talk,Shiny Apps in Genomics and Clinical Trials,"R Shiny has revolutionized the way statisticians and analysts distribute analytic results and research methods. We can easily build interactive web tools that enhance data visualization and facilitate data and information sharing. Shiny apps can empower non-statisticians to explore and visualize their data or perform their own analyses with methods we develop. Harnessing this power, R users have developed Shiny apps for visualizing clinical trials and pharmaceutical data, as well as applications that aid in study design and analysis. I will present examples of how Shiny can be used in many stages of the drug development process and discuss the challenges as well as benefits of incorporating these tools in pharmaceutical workflows.",Jessica Minnier,Oregon Health & Science University,https://jminnier-talks.netlify.app/2018_08_rpharma_shiny/minnier_rpharma2018.html,
2,4:15 PM,talk,"R as the Core Technology to Support Modeling and Simulation in Pharma Research, Development, and Post Approval Activities","Since its foundation in 2004, Metrum Research Group has relied on R as the core technology and central framework for all of the company’s biomedical modeling and simulation (M&S) service activities, spanning more than 475 projects with 150+ different sponsors. Projects include pharmacokinetic-pharmacodynamic modeling, quantitative systems pharmacology models, simulation-based trial design evaluations, disease progression and patient population modeling, model-based meta analysis of competitor data, model-based comparative effectiveness assessments, and data management activities, etc., all within a regulated environment. Analyses were conducted in R or via other software tools which are managed via R scripts, functions, or packages. Key deliverables of M&S projects are routinely provided as R packages or interactive simulation applications, driven by R (and R Shiny). R has also been an essential component of Metrum’s vision for Open Science in biomedical M&S, allowing for accessibility and reproducibility of platform models developed for multiple disease areas.",Marc Gastonquay,Metrum Research Group,https://github.com/rinpharma/2018_presentations/blob/master/talks_folder/2018-Gastonguay-Modeling_and_Simulation_in_Pharma.pdf,
2,4:25 PM,talk,Building a community of competent developers and users of R-based tools in mass spectrometry-based research,"The R-based ecosystem, and its open-source methods for data manipulation, modeling and interpretation, is key for effective and reproducible research. This is certainly true in experiments relying on quantitative mass spectrometry. This relatively new and rapidly evolving field must overcome many sources of unwanted variation. It has many unsolved challenges, both in the appropriate use of the existing methods and tools, and in developing methods that address specialized problems. 
 This talk will illustrate our R-based efforts to promote sound statistical practice, and build a community of competent practitioners. First, we will present Cardinal, a comprehensive tool for quantitative mass spectrometry-based imaging, as well as MSstats, a general but flexible framework for mass spectrometry-based proteomics. We will highlight the importance of these tools for pharmaceutical research in an example of statistical characterization of therapeutic protein modifications. Second, we will detail our efforts of building a community of competent users through a world-wide series of short courses, intended for experimentalists and computational scientists alike.",Olga Vitek,Northeastern University,https://github.com/rinpharma/2018_presentations/blob/master/talks_folder/2018-Vitek-R_Based_Tools_in_Mass_Spectrometry_Research.pdf,
2,4:35 PM,talk,Bayesian Models for Smaller Trial Sizes,"Precision medicine typically refers to the development of drugs and other interventions for individual patients. But how do you assess efficacy and make predictions in this extreme small data regime?
 The Bayesian framework is ideal for this type of inference as it allows us to combine population and personal effects in a principled way and make predictions for both groups and individuals. The inferences are further improved when we introduce mechanistically inspired components into the modeling framework.
 I’ll talk about building pharma models in the small data regime and how we use Stan (a statistical modeling language for Bayesian inference) with R for analysis.",Daniel Lee,Generable,https://github.com/rinpharma/2018_presentations/blob/master/talks_folder/2018-Lee-Bayesian_models_for_smaller_trial_sizes.pdf,
2,4:45 PM,talk,Enhance R Overview,"Recruitment models for clinical trials are notoriously difficult to build due to many complex factors within a study. With input from experienced practitioners, we have built an interactive tool to allow individuals to build complex recruitment models using the R/Shiny framework. The Tool Enhance R, our platform for study modeling, was ported from an Excel-based tool to the R/Shiny platform to increase model development speed, expand capability and drive transparency into model development. The tool allows users to specify critical model attributes (i.e. country site distribution, recruitment/activation rates, country-specific vacations), and provide instantaneous feedback that changes have on a model’s probability of success. Using the RStudio Connect platform, we are able to grant multi-level access to users through a single web interface. Model development is tracked by exporting results to a SharePoint site and logging versions for future review/auditing. This gives significant levels of transparency on how a model was created and evolved over time. For web analytics, we used Piwik, and internal web analytics platform, to monitor how users navigate through the platform and identify browsing behavior. The application was built upon the Shiny Dashboard framework and leverages many visualization packages, including Plotly, Timevis, ggplot2 and many more. Many challenges arose in its develop, from controlling over-zealous user clicks causing out of control execution, to integrating service account execution of apps to facilitate centralized data control. This project pushed the limits of what the R/Shiny platform is capable of and demonstrates how data scientists can build useful solutions.",Jay Timmerman,Covance,https://github.com/rinpharma/2018_presentations/blob/master/talks_folder/2018-Timmerman-Enhance_R.pptx,
2,4:55 PM,talk,The Magic R-Shiny App that can Boost your SDTM Usability and Viability while Saving Time,"The United States Food and Drug Administration (FDA) requires that clinical trial data be submitted in the Study Data Tabulation Model (SDTM) standard format. The process of developing SDTM involves mapping captured raw data to their correspondent SDTM domains based on rules and conditions put by the Clinical Data Interchange Standards Consortium (CDISC) organization. SDTM data is further used for building the Analysis Data Model (ADaM) which is used for clinical trial statistical analysis. Mistakes in the mapping process are common due to the process complexities; issues that are missed may potentially affect the clinical trial result. Therefore, it is very essential to preserve the quality of the SDTM data. Currently, the main tool for checking SDTM conformance is Pinnacle21 (formerly known as OpenCDISC). Notably, there are usability and viability checks that are not included in Pinnacle21. This work describes the creation of an R shiny app to supplement the Pinnacle21 checks. This interactive app applies various CDISC-compliant SDTM data validation checks, and provides the user with a comprehensive report on possible inconsistencies in the data. The app would allow programmers to proactively find data mapping errors. In addition, it is straightforward to use and can save tremendous amounts of time. Additionally, this app’s audience extends beyond the programming community and covers other individuals who have an interest in data quality, particularly Data Managers and individuals in Clinical Science and Clinical Operations.",Elma Zannatul Ferdousy // Katrina Paz // Nasser Al Ali,Genentech // Genentech // Genentech,,
2,5:05 PM,talk,"Reproducible computational research at Eisai: leadership, technology, and culture","The pharmaceutical industry depends on accurate and reproducible data science for both preclinical and clinical analysis. Unfortunately, often an analysis cannot be reproduced and therefore its computational methodology and merit are unknown. Often, the data, code, or description of computational methods is not maintained. In order to implement good practices of reproducible computational research, the leadership of the company must invest time and resources into planning, training, ensuring adoption of common practices and tools, implementing documentation systems, encouraging discipline on the individual and group level, creating incentives, and requiring accountability. At Eisai, we have developed a working system for reproducible computational research that is enabled by leadership, technology, and culture. With regards to technology, we primarily use Rmarkdown and R Notebooks on an Rstudio server used by all our analysts. The Rstudio server is maintained by an administrator who installs packages for all users, creating a common package environment that ensures that code can be rerun in the future. Data and code are stored in a shared network drive and version control is accomplished by using Git. A wiki that is editable by all analysts is used to organize all analyses (tracked with unique analysis IDs) and provides links to code and results.
 With regards to culture, the leadership has promoted the values of quality and reproducibility. When yearly objectives are set, the performance criteria includes the creation of analysis documents (e.g. Rmarkdown reports), use of version control, and organization of data on shared network drives. Setting aside time for wiki documentation in the midst of high demands from project teams is helped by having periodic “documentation day” parties. To verify reproducibility, we have implemented ""witnessing"": once the analysis is finished, it is reviewed by an independent team member who officially signs off on the work, stating that the reproducibility criteria have been met. Our success in implementing reproducible computational research can serve as a model for other companies to use. Here we have provided a model based on leadership, technology, and culture.",Joseph Gerrein,Eisai,,
2,5:15 PM,talk,The Challenges of Validating R,"The first challenge in validating an analytic tool for the pharmaceutical industry is that, despite a formal FDA definition, there is still no cross-industry agreement on what 'validation' really means with respect to an analytic tool. AIMS (Application and Implementation of Methodologies in Statistics), a Special Interest Group within PSI have been attempting to answer this question with respect to R. In doing so we recently received approval from the R Consortium for an online R package validation repository and are now looking to formalise some early definitions. In this presentation I will walk through some of the challenges that we have identified thus far and outline what we're hoping to achieve with the platform.",Andy Nicholls,Glaxosmithkline,https://github.com/rinpharma/2018_presentations/blob/master/talks_folder/2018-Nicholls-The_Challenges_of_Validating_R.pptx,